Warning: Using a password on the command line interface can be insecure.
--------------
SELECT * FROM westernCourses
--------------

Empty set (0.00 sec)

--------------
SELECT * FROM universities
--------------

Empty set (0.00 sec)

--------------
SELECT * FROM outsideCourses
--------------

Empty set (0.00 sec)

--------------
SELECT * FROM equivalent
--------------

Empty set (0.00 sec)

--------------
LOAD DATA LOCAL INFILE 'loaddatafall2020.txt' INTO TABLE universities FIELDS TERMINATED by','
--------------

Query OK, 8 rows affected, 5 warnings (0.01 sec)
Records: 8  Deleted: 0  Skipped: 0  Warnings: 5

--------------
DELETE FROM universities WHERE universityNum = 0
--------------

Query OK, 1 row affected (0.02 sec)

--------------
SELECT * FROM universities
--------------

+---------------+--------------------------------+-----------+--------------+----------+
| universityNum | officialName                   | city      | provinceCode | nickname |
+---------------+--------------------------------+-----------+--------------+----------+
|             2 | University Of Toronto          | Toronto   | ON           | UofT     |
|             4 | University of Waterloo         | Waterloo  | ON           | Waterloo |
|            24 | Concordia University           | Montreal  | QB           | Concord  |
|            55 | McMaster University            | Hamilton  | ON           | Mac      |
|            66 | University of British Columbia | Vancouver | BC           | UBC      |
|            77 | Wilfred Laurier University     | Waterloo  | ON           | Laurier  |
|            88 | McGill University              | Montreal  | QB           | McGill   |
+---------------+--------------------------------+-----------+--------------+----------+
7 rows in set (0.00 sec)

--------------
INSERT INTO westernCourses (courseNum, courseName, weight, suffix) VALUES ("cs1026", "Computer Science Fundamentals I", 0.5, "A/B")
--------------

Query OK, 1 row affected (0.01 sec)

--------------
INSERT INTO westernCourses (courseNum, courseName, weight, suffix) VALUES ("cs1027", "Computer Science Fundamentals II", 0.5, "A/B")
--------------

Query OK, 1 row affected (0.01 sec)

--------------
INSERT INTO westernCourses (courseNum, courseName, weight, suffix) VALUES ("cs2210","Algorithms and Data Structures", 1.0, "A/B")
--------------

Query OK, 1 row affected (0.01 sec)

--------------
INSERT INTO westernCourses (courseNum, courseName, weight, suffix) VALUES ("cs3319",
 "Databases I", 0.5, "A/B")
--------------

Query OK, 1 row affected (0.01 sec)

--------------
INSERT INTO westernCourses (courseNum, courseName, weight, suffix) VALUES ("cs2120","Modern Survival Skills I: Coding Essentials", 0.5, "A/B")
--------------

Query OK, 1 row affected (0.00 sec)

--------------
INSERT INTO westernCourses (courseNum, courseName, weight, suffix) VALUES ("cs4490","Thesis", 0.5, "Z")
--------------

Query OK, 1 row affected (0.01 sec)

--------------
INSERT INTO westernCourses (courseNum, courseName, weight, suffix) VALUES ("cs0020","Intro to Coding using Pascal and Fortran", 1.0,"" )
--------------

Query OK, 1 row affected (0.00 sec)

--------------
INSERT INTO universities (universityNum, officialName, nickname, city, provinceCode) VALUES (9, "University of Annie", "UofA", "Burlington", "ON")
--------------

Query OK, 1 row affected (0.01 sec)

--------------
INSERT INTO outsideCourses(courseCode, courseName, weight, yearOfStudents, universityNum) VALUES ("CompSci022", "Introduction to Progamming", 0.5, 1, 2)
--------------

Query OK, 1 row affected (0.01 sec)

--------------
INSERT INTO outsideCourses(courseCode, courseName, weight, yearOfStudents, universityNum) VALUES ("CompSci033", "Intro to Programming for Med students", 0.5, 3, 2)
--------------

Query OK, 1 row affected (0.00 sec)

--------------
INSERT INTO outsideCourses(courseCode, courseName, weight, yearOfStudents, universityNum) VALUES ("CompSci021", "Packages", 0.5, 1, 2)
--------------

Query OK, 1 row affected (0.01 sec)

--------------
INSERT INTO outsideCourses(courseCode, courseName, weight, yearOfStudents, universityNum) VALUES (
"CompSci222", "Introduction to Databases", 1.0, 2, 2)
--------------

Query OK, 1 row affected (0.01 sec)

--------------
INSERT INTO outsideCourses(courseCode, courseName, weight, yearOfStudents, universityNum) VALUES ("CompSci023", "Advanced Programming", 0.5, 1, 2)
--------------

Query OK, 1 row affected (0.00 sec)

--------------
INSERT INTO outsideCourses(courseCode, courseName, weight, yearOfStudents, universityNum) VALUES ("CompSci011", "Intro to Computer Science", 0.5, 2, 4)
--------------

Query OK, 1 row affected (0.09 sec)

--------------
INSERT INTO outsideCourses(courseCode, courseName, weight, yearOfStudents, universityNum) VALUES ("CompSci123", "Using UNIX", 0.5, 2, 4)
--------------

Query OK, 1 row affected (0.00 sec)

--------------
INSERT INTO outsideCourses(courseCode, courseName, weight, yearOfStudents, universityNum) VALUES ("CompSci021", "Intro Programming", 1.0, 1, 66)
--------------

Query OK, 1 row affected (0.01 sec)

--------------
INSERT INTO outsideCourses(courseCode, courseName, weight, yearOfStudents, universityNum) VALUES ("CompSci022", "Advanced Programming", 1.0, 1, 66)
--------------

Query OK, 1 row affected (0.00 sec)

--------------
INSERT INTO outsideCourses(courseCode, courseName, weight, yearOfStudents, universityNum) VALUES ("CompSci319", "Using Databases", 0.5, 3, 66)
--------------

Query OK, 1 row affected (0.01 sec)

--------------
INSERT INTO outsideCourses(courseCode, courseName, weight, yearOfStudents, universityNum) VALUES ("CompSci333", "Graphics", 0.5, 3, 55)
--------------

Query OK, 1 row affected (0.00 sec)

--------------
INSERT INTO outsideCourses(courseCode, courseName, weight, yearOfStudents, universityNum) VALUES ("CompSci444", "Networks", 0.5, 4, 55)
--------------

Query OK, 1 row affected (0.01 sec)

--------------
INSERT INTO outsideCourses(courseCode, courseName, weight, yearOfStudents, universityNum) VALUES ("CompSci022", "Using Packages", 0.5, 1, 77)
--------------

Query OK, 1 row affected (0.01 sec)

--------------
INSERT INTO outsideCourses(courseCode, courseName, weight, yearOfStudents, universityNum) VALUES ("CompSci101", "Introduction to Using Data Structures", 0.5, 2, 77)
--------------

Query OK, 1 row affected (0.01 sec)

--------------
INSERT INTO outsideCourses(courseCode, courseName, weight, yearOfStudents, universityNum) VALUES ("CompSci999", "Intro to Annie Programming", 1, 1, 9)
--------------

Query OK, 1 row affected (0.01 sec)

--------------
INSERT INTO outsideCourses(courseCode, courseName, weight, yearOfStudents, universityNum) VALUES ("CompSci321", "Coding Coolness", 0.5, 4, 9)
--------------

Query OK, 1 row affected (0.01 sec)

--------------
INSERT INTO equivalent (westernCourseNum, outsideCourseCode, universityNum, date) VALUES ("cs1026", "CompSci022", 2, "2015-05-12")
--------------

Query OK, 1 row affected (0.00 sec)

--------------
INSERT INTO equivalent (westernCourseNum, outsideCourseCode, universityNum, date) VALUES ("cs1026", "CompSci033", 2, "2013-01-02")
--------------

Query OK, 1 row affected (0.01 sec)

--------------
INSERT INTO equivalent (westernCourseNum, outsideCourseCode, universityNum, date) VALUES ("cs1026", "CompSci011", 4, "1997-02-09")
--------------

Query OK, 1 row affected (0.00 sec)

--------------
INSERT INTO equivalent (westernCourseNum, outsideCourseCode, universityNum, date) VALUES ("cs1026", "CompSci021", 66, "2010-01-12")
--------------

Query OK, 1 row affected (0.01 sec)

--------------
INSERT INTO equivalent (westernCourseNum, outsideCourseCode, universityNum, date) VALUES ("cs1027", "CompSci023", 2 ,"2017-06-22")
--------------

Query OK, 1 row affected (0.00 sec)

--------------
INSERT INTO equivalent (westernCourseNum, outsideCourseCode, universityNum, date) VALUES ("cs1027", "CompSci022", 66, "2019-09-01")
--------------

Query OK, 1 row affected (0.01 sec)

--------------
INSERT INTO equivalent (westernCourseNum, outsideCourseCode, universityNum, date) VALUES ("cs2210", "CompSci101", 77, "1998-07-12")
--------------

Query OK, 1 row affected (0.01 sec)

--------------
INSERT INTO equivalent (westernCourseNum, outsideCourseCode, universityNum, date) VALUES ("cs3319", "CompSci222", 2, "1990-09-13")
--------------

Query OK, 1 row affected (0.00 sec)

--------------
INSERT INTO equivalent (westernCourseNum, outsideCourseCode, universityNum, date) VALUES ("cs3319", "CompSci319", 66, "1987-09-21")
--------------

Query OK, 1 row affected (0.01 sec)

--------------
INSERT INTO equivalent (westernCourseNum, outsideCourseCode, universityNum, date) VALUES ("cs2120", "CompSci022", 2, "2018-12-10")
--------------

Query OK, 1 row affected (0.00 sec)

--------------
INSERT INTO equivalent (westernCourseNum, outsideCourseCode, universityNum, date) VALUES ("cs0020", "CompSci022", 2,"1999-09-17")
--------------

Query OK, 1 row affected (0.01 sec)

--------------
SELECT * FROM westernCourses
--------------

+---------------------------------------------+--------+--------+-----------+
| courseName                                  | weight | suffix | courseNum |
+---------------------------------------------+--------+--------+-----------+
| Intro to Coding using Pascal and Fortran    |      1 |        | cs0020    |
| Computer Science Fundamentals I             |    0.5 | A/B    | cs1026    |
| Computer Science Fundamentals II            |    0.5 | A/B    | cs1027    |
| Modern Survival Skills I: Coding Essentials |    0.5 | A/B    | cs2120    |
| Algorithms and Data Structures              |      1 | A/B    | cs2210    |
| Databases I                                 |    0.5 | A/B    | cs3319    |
| Thesis                                      |    0.5 | Z      | cs4490    |
+---------------------------------------------+--------+--------+-----------+
7 rows in set (0.00 sec)

--------------
SELECT * FROM universities
--------------

+---------------+--------------------------------+------------+--------------+----------+
| universityNum | officialName                   | city       | provinceCode | nickname |
+---------------+--------------------------------+------------+--------------+----------+
|             2 | University Of Toronto          | Toronto    | ON           | UofT     |
|             4 | University of Waterloo         | Waterloo   | ON           | Waterloo |
|             9 | University of Annie            | Burlington | ON           | UofA     |
|            24 | Concordia University           | Montreal   | QB           | Concord  |
|            55 | McMaster University            | Hamilton   | ON           | Mac      |
|            66 | University of British Columbia | Vancouver  | BC           | UBC      |
|            77 | Wilfred Laurier University     | Waterloo   | ON           | Laurier  |
|            88 | McGill University              | Montreal   | QB           | McGill   |
+---------------+--------------------------------+------------+--------------+----------+
8 rows in set (0.00 sec)

--------------
SELECT * FROM outsideCourses
--------------

+------------+---------------------------------------+--------+----------------+---------------+
| courseCode | courseName                            | weight | yearOfStudents | universityNum |
+------------+---------------------------------------+--------+----------------+---------------+
| CompSci011 | Intro to Computer Science             |    0.5 |              2 |             4 |
| CompSci021 | Packages                              |    0.5 |              1 |             2 |
| CompSci021 | Intro Programming                     |      1 |              1 |            66 |
| CompSci022 | Introduction to Progamming            |    0.5 |              1 |             2 |
| CompSci022 | Advanced Programming                  |      1 |              1 |            66 |
| CompSci022 | Using Packages                        |    0.5 |              1 |            77 |
| CompSci023 | Advanced Programming                  |    0.5 |              1 |             2 |
| CompSci033 | Intro to Programming for Med students |    0.5 |              3 |             2 |
| CompSci101 | Introduction to Using Data Structures |    0.5 |              2 |            77 |
| CompSci123 | Using UNIX                            |    0.5 |              2 |             4 |
| CompSci222 | Introduction to Databases             |      1 |              2 |             2 |
| CompSci319 | Using Databases                       |    0.5 |              3 |            66 |
| CompSci321 | Coding Coolness                       |    0.5 |              4 |             9 |
| CompSci333 | Graphics                              |    0.5 |              3 |            55 |
| CompSci444 | Networks                              |    0.5 |              4 |            55 |
| CompSci999 | Intro to Annie Programming            |      1 |              1 |             9 |
+------------+---------------------------------------+--------+----------------+---------------+
16 rows in set (0.00 sec)

--------------
SELECT * FROM equivalent
--------------

+------------------+-------------------+---------------+------------+
| westernCourseNum | outsideCourseCode | universityNum | date       |
+------------------+-------------------+---------------+------------+
| cs0020           | CompSci022        |             2 | 1999-09-17 |
| cs1026           | CompSci011        |             4 | 1997-02-09 |
| cs1026           | CompSci021        |            66 | 2010-01-12 |
| cs1026           | CompSci022        |             2 | 2015-05-12 |
| cs1026           | CompSci033        |             2 | 2013-01-02 |
| cs1027           | CompSci022        |            66 | 2019-09-01 |
| cs1027           | CompSci023        |             2 | 2017-06-22 |
| cs2120           | CompSci022        |             2 | 2018-12-10 |
| cs2210           | CompSci101        |            77 | 1998-07-12 |
| cs3319           | CompSci222        |             2 | 1990-09-13 |
| cs3319           | CompSci319        |            66 | 1987-09-21 |
+------------------+-------------------+---------------+------------+
11 rows in set (0.00 sec)

--------------
UPDATE equivalent SET date = '2018-09-19' WHERE westernCourseNum = "cs0020" AND outsideCourseCode="Compsci022" AND universityNum=2
--------------

Query OK, 1 row affected (0.01 sec)
Rows matched: 1  Changed: 1  Warnings: 0

--------------
UPDATE outsideCourses SET yearOfStudents=1 WHERE courseName LIKE "Intro%"
--------------

Query OK, 4 rows affected (0.00 sec)
Rows matched: 7  Changed: 4  Warnings: 0

--------------
SELECT * FROM outsideCourses
--------------

+------------+---------------------------------------+--------+----------------+---------------+
| courseCode | courseName                            | weight | yearOfStudents | universityNum |
+------------+---------------------------------------+--------+----------------+---------------+
| CompSci011 | Intro to Computer Science             |    0.5 |              1 |             4 |
| CompSci021 | Packages                              |    0.5 |              1 |             2 |
| CompSci021 | Intro Programming                     |      1 |              1 |            66 |
| CompSci022 | Introduction to Progamming            |    0.5 |              1 |             2 |
| CompSci022 | Advanced Programming                  |      1 |              1 |            66 |
| CompSci022 | Using Packages                        |    0.5 |              1 |            77 |
| CompSci023 | Advanced Programming                  |    0.5 |              1 |             2 |
| CompSci033 | Intro to Programming for Med students |    0.5 |              1 |             2 |
| CompSci101 | Introduction to Using Data Structures |    0.5 |              1 |            77 |
| CompSci123 | Using UNIX                            |    0.5 |              2 |             4 |
| CompSci222 | Introduction to Databases             |      1 |              1 |             2 |
| CompSci319 | Using Databases                       |    0.5 |              3 |            66 |
| CompSci321 | Coding Coolness                       |    0.5 |              4 |             9 |
| CompSci333 | Graphics                              |    0.5 |              3 |            55 |
| CompSci444 | Networks                              |    0.5 |              4 |            55 |
| CompSci999 | Intro to Annie Programming            |      1 |              1 |             9 |
+------------+---------------------------------------+--------+----------------+---------------+
16 rows in set (0.00 sec)

--------------
SELECT * FROM equivalent
--------------

+------------------+-------------------+---------------+------------+
| westernCourseNum | outsideCourseCode | universityNum | date       |
+------------------+-------------------+---------------+------------+
| cs0020           | CompSci022        |             2 | 2018-09-19 |
| cs1026           | CompSci011        |             4 | 1997-02-09 |
| cs1026           | CompSci021        |            66 | 2010-01-12 |
| cs1026           | CompSci022        |             2 | 2015-05-12 |
| cs1026           | CompSci033        |             2 | 2013-01-02 |
| cs1027           | CompSci022        |            66 | 2019-09-01 |
| cs1027           | CompSci023        |             2 | 2017-06-22 |
| cs2120           | CompSci022        |             2 | 2018-12-10 |
| cs2210           | CompSci101        |            77 | 1998-07-12 |
| cs3319           | CompSci222        |             2 | 1990-09-13 |
| cs3319           | CompSci319        |            66 | 1987-09-21 |
+------------------+-------------------+---------------+------------+
11 rows in set (0.00 sec)

Bye
